43,NARC,3,25,524 3 25 1 001,15,,"Long: 85.3252, Lat: 27.6521, Elev: 1330m",85.3252,27.6521,1330,"491,893.14","393,214.52","112,347","Settlement Camp, Logistics, Medical Assistance Area, Distribution Area, Helipad, Telecommunication, Portable Water Source","Research purpose, seminar","Satdobato, Lagankhel, Hattiban",All year round,Lalitpur Metropolitan City,It is the largest research station in the field of agriculture in the country. The area has a large open space which is suitable for IDP camp.,Yes (for related stakeholders),Yes,Yes (concrete wall with fence),Yes,Yes Trees and grasses can be seen within the sites,"Sumeru Hospital, Harisidhhi Cancer Hospital",Satdobato market,"Yes (Traffic Office Satdobato, Nepal Army Camp, Lalitpur)",Yes,"Little Angels Higher Secondary School, Premier School, Sampurna Boarding School, Kathmandu International College of Theology, Bright Vision College, Grand Academy, Kathmandu University School of Arts",Waste management and drainage issue,"NARC is situated in Khumaltar of Lalitpur district, south of the Ring Road of Kathmandu
Valley. It extends to an area of 491,893.14 sq. m., out of which 393,214.52 sq. m. is
found to be usable. The site is under the ownership of the Ministry of Agricultural, Land
Management and Cooperatives. The previous study suggested the site to be feasible for
several purposes including settlement/camp, logistics, medical assistance, distribution,
helipad, telecommunications and potable water source during a disaster. The updated
survey shows numerous greenhouse tunnels for research purposes within the site, which
has reduced the usable area for the proposed use as per the previous study. However, the
army camp near NARC and adequate water supply in the area can strengthen the camp
management during a disaster.",NARC,0.03303,4.48E-05,43,0106000020E610000001000000010300000001000000BB000000AC21DF5ED9545540C0FF92D4DEA73B4088D912FFDA54554050907BBBDEA73B4094C202B3DB545540D044211C19A83B4064A06B40DC545540A005BEF61DA83B407838D899E15455407079D0E524A83B40A41505E1E7545540709224B707A83B4058A742EEEC5455407009EB74F1A73B4084B074F1F0545540408EE7C6DFA73B40EC5C1015F254554020B4E204D9A73B40EC963975F7545540B0D40F1BC1A73B4080EC966FF7545540D060889CBFA73B401C2B2CABF7545540E00441E2B8A73B40AC079B7FF754554080E0C7DBB5A73B40A084559AF65455409020AFC3AEA73B40D41C3F2EF65455407072AA13ACA73B40B05A76FEF4545540906CDFFE9FA73B40F057FF3FF4545540A00635C895A73B40FC88BACBF5545540906BDAA88FA73B40B837DD15F6545540E0DDF4888CA73B40A464BBDEF4545540C08D47F376A73B40501341C9F55455408059F0FB6DA73B40F07A1A65F85455409036E9D661A73B40E88EFE91F8545540207F08F75EA73B40000D9E75F8545540A0BCD82659A73B409C2F6873F8545540D06130414EA73B4024348EC2F8545540A0E867FB49A73B401080DD01F954554010958C1648A73B40E83F58CAF8545540404FA0D144A73B404479C851F8545540E041553B41A73B40F8D70E4AF8545540F0B953DB3EA73B4038792BF2F85455402078E7633BA73B4030400B1AF95455400089EDA939A73B40C4170D24F9545540A06B2F5E37A73B4048E8172BF85455405002A2A72DA73B40B4E160F8F7545540E0ABEFFD28A73B403090E97CF75455400006DDA221A73B40001E334DF5545540D07CF41112A73B40F8975163F454554060CF889D0CA73B4060E7025EF354554000379F2A02A73B40B83FA813F4545540A05109FE00A73B404C879221F5545540308711B9FFA63B4010A38540F6545540107EAEA1FDA63B40C8486ECBF65455407007407FFAA63B406CD9F8ABF6545540703E3FE1F7A63B409886FE07F5545540D0219C3EE6A63B4090DB479CF85455402041A489DBA63B4034842510FC545540F003C49AD4A63B406092B075FD545540D07CB86BD2A63B4094242941FF54554030AA45FACAA63B402021A2B6015555404099A686C2A63B4078AAF01803555540A01AEB29BCA63B401C1CDB7F015555407038EDFFB0A63B40483F679A00555540D099E9A8A9A63B4080EE2ACC00555540A0C63B79A5A63B400C52CE3801555540106E4E47A1A63B40A09AF0E10055554090DF5E8E9BA63B40A4BA8A25FF545540A043170A8BA63B40ECF85FCCFE5455406072B3B987A63B402CD0BF65FE54554000689E7684A63B40D88E4175FE5455409056D8AC81A63B40C004EAF1FE545540E093EC587BA63B4078FD5618FF545540D0D3CA1D70A63B40C830D412FF54554020481CFD68A63B4014CCA238FF5455402042245E65A63B4000A69B4EFF545540D05E8FFA64A63B40B8B586950155554050B00AA85AA63B40440296E0025555400004FFAE51A63B40A05D8A7303555540506E53B34DA63B4038EFFAA504555540105B19A14AA63B401CFB585107555540E0FCC0C743A63B40D0DF8C78075555402023A1E13FA63B40789CB45207555540F07D208F3AA63B404C85F4C7065555407049767F21A63B409837C25A0655554040AA32D01CA63B40EC5318180255554080C7E86026A63B4008F98824015555407063CE7525A63B4058237A9E00555540507C2DC322A63B4084F40B7AFF545540400BDF4119A63B4054D15707FF54554030318B4714A63B407CE4EEA7FD54554090F9D6C602A63B401CC1834BFD545540E0B24DBDFEA53B40A425EF6DFB54554020D495B3F3A53B4058B57D83F95455402089692FEBA53B40585BA4DEF854554040D0732CD8A53B4064DADEFDF754554080AF19FECDA53B40A875B4CEF65455408098D0BBB4A53B401078665EF6545540A047BA55ADA53B4054BC730EF654554040E3DF5DA8A53B40385EA7A5F55455406070E75DA3A53B40C8BEC2FDF4545540C02CBDFFA1A53B4038C63028E854554040CFF174AAA53B4098D0EB86E754554070AC39DFAAA53B405086F0F3E154554000715911B5A53B403C8E522FE15455403016DCFCB4A53B40384AB252E0545540108CDDE5B4A53B40B01C05B0DE545540A0760FDFB2A53B4084BDC1DADC545540F07AD427B0A53B40782A93D0D354554030CADC5DBEA53B40AC3D4B1ED5545540201247CDDFA53B4074A35EB0D6545540C039103F0EA63B40B8CDD588D7545540B04E2DE71BA63B40501521AED7545540F00CAE6F21A63B4064647D5FD65455406091EC8422A63B40580B674ED6545540D0B518EC21A63B404C44ECD7D4545540504D789A22A63B40C82D6160D354554050F44E9924A63B40D47A075FD3545540F0E62BD325A63B40B0B02170D354554010C045A92AA63B40F01A8C65D3545540A098468F2BA63B40942A8502D354554050FDACF633A63B40BC4EF2D4D254554050122BC639A63B40DC0BE5FFD1545540508F445F3DA63B40BCC06DCDD1545540406F69393EA63B406875AC0DD054554090DC00C641A63B40941A202BCE545540A01A7B7843A63B40D077DA4FCC54554050438F5E44A63B4064A4B590CB545540D0321CBB44A63B400C47D213CB545540105A101945A63B40C0B787F0C9545540306E2CF445A63B407CE79261C854554050B4DADE47A63B4010B79247C7545540500188004AA63B40400F251EC6545540F0B0C6C24DA63B40B8E03FE0C5545540F019C80954A63B4044F52DB7C4545540A029E04258A63B40F873B275C4545540A0F45FE559A63B400CE3B738C354554010977DF159A63B401C1700FBC2545540C0C1E97360A63B409426387AC1545540A009081E5FA63B4000A6A29BBE54554060ADC8875EA63B4070C89CADBB545540A0E031925FA63B40941A23F5B7545540E0706C3B63A63B404CE7BE84B75455403003B91464A63B40B4045DABB4545540304ECC9669A63B404C596EA2B3545540604E924E6BA63B402C8B581EB3545540B03A59D664A63B40284BBD05A854554010EA4A8264A63B403CFA86E2A554554040A76E5957A63B406472A6B7A2545540C0ADDC8653A63B40102B6C709F545540F0F87F8A5FA63B40E079F0029F545540F052744261A63B4008271DC79654554060459DCA84A63B409CB68CB893545540D0C0D18B91A63B409894737096545540A0E9D9FBA4A63B40042CAD4F9754554000316F17B4A63B40A065997897545540206BE927BDA63B4050283A3E98545540A0BC9741C4A63B4024353A589554554080B96E03D9A63B40980EA1DC935455401041F128DFA63B4084FE4C5C92545540D00CFA07EDA63B4054173C3C92545540202B95D9FAA63B40DC3993439254554020F70A24FDA63B4068DE5F5792545540D045A4A7FFA63B40581F39C6925455405029E89015A73B40246DAA8C92545540A0A1D6A822A73B404051ACB192545540109D5E8828A73B4040D53FAB925455405085CCE137A73B40946EF0E39254554090A472D445A73B404C34ACE9925455404066893D47A73B407436E2D7915455409024B88C48A73B402C0F1B6C93545540607E5F8554A73B4074D442CF935455405087498458A73B405430665395545540D097B8F562A73B4014CBBD7298545540308E045683A73B40E463FCC69854554070DEFF129AA73B402C4B9E019954554020C8B1B2ABA73B4050D8CBC09A5455400020EAA5A9A73B40309310E59D545540A042F71EA5A73B40647F5DBB9F54554020030B8BACA73B4078F966D0A25455409066BCC5ADA73B40040CB14BA7545540100F8F05AFA73B40DCB94A39A9545540A07967BEB5A73B408449FE95A9545540E025E7BEBBA73B40440C69ADAB545540E0B54A29CFA73B403C698EA6A9545540706CBD47D1A73B40345091F9AB545540D07B5515EAA73B4084CB9B72AE545540B019156BFEA73B4054944BD8B0545540B0D512460FA83B4068871621B25455400024EB8B1EA83B404417D6B1B5545540E0B872BB2DA83B4070276C8CBC545540A09DAD9D25A83B40D08CE237C5545540C08A4CBA1BA83B40D88B85CDC754554000893E3314A83B4018A9DFF0CB54554070A5832109A83B4044362BD4CD54554040E1C35C08A83B4050B9B113D3545540A01470F2FDA73B408CA63EA8D654554020D6BED3E6A73B40AC21DF5ED9545540C0FF92D4DEA73B40
44,Nasamana,3,26,524 3 26 3 003,3,,"Long: 85.4273, Lat: 27.6706, Elev:1331m",85.4273,27.6706,1331,762.3,726.545,207,Distribution Area,"Cultural programs, gathering, pottery",Bhaktapur,All year round,Bhaktapur Municipality,Numerous old buildings and monuments are present nearby the site,Yes (charges apply),No,Yes (concrete wall),Yes,No,"Siddhi Memorial Hospital, District Eye Care Centre, Bhaktapur",Bhaktapur Market,Yes (Bhaktapur Police Station and Nepal Army at Sainik School),No,"Sainik Awasiya Mahavidyalaya, Everest English School",Waste management,"Nasamana is located in the densely populated area of Bhaktapur City. It extends to an area
of 762.296 sq. m., out of which 726.545 sq. m. is found to be usable. The site is under the
ownership of Bhaktapur Municipality. The previous study suggested the site to be suitable
to be utilized as distribution area during a disaster. The updated survey shows additional
constructions as two buildings were renovated in the southwest side of the site which
has reduced the usable area. However, the site has a large area and is suitable for the
establishment of a large IDP camp and as distribution points to the nearest clustered areas.",Nasamana,0.001173,6.97E-08,44,0106000020E61000000100000001030000000100000020000000A04386F7535B554070CF78F69FAB3B406C88284A545B5540302CB87AA1AB3B40300DF256545B5540D0ECB36CA3AB3B40F4E8591B545B554050E4CD6DA3AB3B404412C138545B554020E6BD58A7AB3B4090729926545B5540707FA5B7AAAB3B40D071CE5E545B55402084B605AFAB3B40DC377462545B554000F78635AFAB3B4070F28683545B5540408F1F80B2AB3B402864A687545B554010D55563B3AB3B40347BB7D3545B5540D04EF12CB3AB3B40047D8922555B5540E0AA9EA8B2AB3B4090926A08595B55405037D9CFAFAB3B4054979C13595B554060E829D4AFAB3B4000C75CE6585B55406084F6E6ABAB3B40FC95E7D6585B5540707EFD36ABAB3B40A8124163585B55408014CA66ABAB3B407885044E585B554030345C88A9AB3B408C77ADFC575B5540B0151F9DA9AB3B404CF431F2575B5540D0367340A8AB3B40A4BEECEE575B554020FB3DC1A7AB3B405419EAC7575B554070632CC3A7AB3B4050C133AA575B554060C2D76BA3AB3B40D06F459E575B5540A029D0C5A2AB3B409044628D575B5540E0C217C4A0AB3B404C34AE7E575B5540402D56C79FAB3B40E4105401575B5540E0492404A0AB3B40940796F5565B5540E0379C1D9EAB3B40BC9D88F4565B554090DEEB469DAB3B405892F388555B5540208866079EAB3B40A8A1DF69545B5540F081B04B9FAB3B40A04386F7535B554070CF78F69FAB3B40
45,National Academy,3,27,524 3 27 1 001,28,,"Long: 85.3208, Lat: 27.7089, Elev: 1294m",85.3208,27.7089,1294,"24,423.20","18,082.43","5,166",Humanitarian Camp,"Seminars, meetings, art and craft exhibition, cultural programs","Expect IDPs from Bagbazar, Dillibazar areas","All season road, year-round access",Nepal Government,"National institution of Nepal for promotion of the languages, literature, culture, philosophy and social sciences of Nepal",yes (within premises for all stakeholders),yes (within the premises),Yes (High concrete wall with fences),Yes,Yes Dense vegetation with garden,"Trauma Hospital, Bir Hospital",Ratnapark and Durbarmarg market,"Yes (APF opposite to National Academy, Nepal Police nearby and Nepal Army at Bhadrakali)",No,"KMC College, Uniglobe College, Trichandra Campus",-,"The National Academy is located in the densely populated central region of Kathmandu
Valley. It extends to an area of 24,423.20 sq. m., out of which 18,082.43 sq. m. is found to
be usable. The site is under the ownership of the Ministry of Federal Affairs, Constituent
Assembly, Parliamentary Affairs and Culture. The previous study suggested the site to
be suitable to be utilized as a humanitarian camp during a disaster. The updated survey
shows the addition of three buildings and one temple. The structures have reduced the
usable area for humanitarian camp as proposed by the previous study. Nevertheless, the
attached Automated Teller Machine (ATM) and a well-managed WASH facility will aid in the
camp management during a disaster.",National Academy,0.006137,2.23E-06,45,0106000020E61000000100000001030000000100000030000000C8BB6B317A545540709070F042B53B401077F4477A545540101670DF54B53B40A05CC0997A545540F0291E3E64B53B40A47EC3E07A54554030F4880265B53B405440B2F17A5455409023829565B53B40F02E89FF7A54554080054E446AB53B4064226BC07A545540801B80616BB53B40B8CED6E07A545540F0D0787A70B53B40B0E3B44F7B5455408016351484B53B40083575E17B545540900B1B809BB53B40C4CA86167C545540A0EDAA4DA7B53B40C8C46C317C545540C0DB3FF2ABB53B405CBA0A3F7C545540A00D254CAEB53B40F4A38AFB7C5455406006D444B7B53B405C9D774B7E545540607471E1B9B53B40988BB1FA81545540C0EC168CB8B53B40E8D9651A85545540B026DEE4B6B53B40488AC687865455400020EA69B5B53B407C86C25B87545540D002F76FB5B53B409CC84CF687545540D04C5F70B5B53B40DC8DB7C48A545540F00C1809B4B53B40389DB885905455406010118AB0B53B40549B5AB69054554090BF1215AFB53B40AC8718FA90545540005FC2A7AAB53B40E038ADF190545540F03713C5A7B53B4060FE0A7A90545540C098F51591B53B400818A36390545540B04287D68CB53B4068CA301490545540D0C581C57DB53B409C0EE9F18F545540D07E13E076B53B40D8A5AEDA8F545540C0A8DB8A73B53B408400DBB68F545540D061346E6BB53B405801669C8F54554020918DA066B53B40707D16968F5455407048568F63B53B40E4DA80F98E545540D0C000D462B53B406063FEF98E54554060A64F835EB53B40203377708F5455405018A8BD5CB53B40BC4BC0458F5455401029627554B53B40482339E08E54554090A74B1641B53B40D4A1C5E286545540D0117AC340B53B40E0733C10865455406019443A44B53B406817394B855455401084CB4144B53B40AC21B55085545540108C71E846B53B40F0058E9483545540205BAB1747B53B40C0FD91938354554040B6143B45B53B40A40AFBE7825455400010A14145B53B40F896669B81545540505833E141B53B40D8438CB57D545540807B2FE141B53B40C8BB6B317A545540709070F042B53B40
46,Nepal Bal Mandir,3,27,524 3 27 1 001,1,,"Long: 85.3309, Lat: 27.7136, Elev: 1308m",85.3309,27.7136,1308,"14,948.80","13,038.14","3,725",Settlement Camp,"Commercial purpose, handicraft programs and skill development activities, Lalitkala)","Gyneshwor, Tangal, Naxal and Handigaun areas",All year round,Kathmandu Metropolitan City,The site is intersected by Dhobikhola,Yes (for students and staffs),Yes,Yes (Concrete wall with fences),Yes,Yes Partially dense,Himal Hospital,Tangal Market,Yes (Nepal Policewithin 100m and Nepal Army 11th Brigade),Yes (inside Narayanhiti Durbar Museum),"Tangal School, Vidyapath School",Drainage and garbage management issue,"Nepal Bal Mandir is located in the northeast of Kathmandu Valley inside the Ring Road.
Dhobi Khola intersects the identified site. It extends to an area of 14,948.80 sq. m., out
of which 13,038.14 sq. m. is found to be usable. The site is under the ownership of the
Ministry of Women, Children and Social Welfare. The previous study suggested the site
to be suitable for settlement/camp during a disaster. The updated survey shows the
reduction of usable area due to few added buildings in the site. However, fencing around
the site adds to the security of location during camp management. Likewise, the site is in
the school premises and has a well-managed WASH facility that will strengthen the camp
management.",Nepal Bal Mandir,0.006775,1.37E-06,46,0106000020E610000001000000010300000001000000480000003C901C301E55554030E808F79BB63B40E093493D1F555540909DFF76A6B63B403072584C20555540B0CFE748AFB63B40CCF125FD2155554070E146B7BCB63B400CCE151F22555540C0324DB5C5B63B402013B34E22555540200FC7BECAB63B40E4F2FD802255554020CAB810D0B63B40207AA4862255554050DA690ED1B63B4040E068DF22555540A08DCB31D1B63B404495295B235555402050D331D2B63B40ECE8C2D4235555408008E401D4B63B409CEB27B423555540009B20FCD5B63B4050957E2D23555540204178D2DAB63B40A833D87823555540701D17ABDEB63B40D4C5ECA323555540C0DEF3DDE0B63B40FC0581A92555554040C1543FDFB63B40746F547426555540B095E09CDEB63B407417EAD43355554000C6B4E5D3B63B40885F6B9633555540A0A94125CEB63B408CE9BA6E33555540A043FD8FCAB63B40D00C2A6533555540C0F8F7CAC9B63B40F8201C5F31555540F09A87CECBB63B40B8D873CE30555540006E929CC4B63B40A0CF0EA63055554030DCD2BAC4B63B40FCC8E47C30555540C0BD08C6C4B63B4044E2A34730555540906C04B8C4B63B402C10CE1330555540C06B3D8AC4B63B4030C0E0E22F555540B02FF83DC4B63B40B40F46B62F555540A01A78D5C3B63B4060963E8F2F55554000A6A653C3B63B40F4EAEE6E2F555540102F51BCC2B63B408CC53F562F555540F016B513C2B63B403CB9E5452F555540408FBD5EC1B63B40EC685B3E2F555540600088A2C0B63B4014781E3F2F5555402095A740C0B63B4094F9D43F2F555540D0127FE4BFB63B4068BA494A2F555540506F0D2ABFB63B40186B6C5D2F555540C0049678BEB63B4080F5B2782F555540800E1FD5BDB63B40A099519B2F555540F0AA5D44BDB63B4014584BC42F555540905470CABCB63B40ECCE75F22F555540E0BEE26ABCB63B40A00D7E243055554020966028BCB63B40AC2FB37F2F55554010A3F3F5B3B63B4060B7B98A2E555540C0FFBAE9B4B63B403415CE092E55554020313080AEB63B40B884C8FE2E555540D01A618CADB63B40589CE3F42D555540905DAA52A0B63B40C4CAD1662E55554050194BE19FB63B40802204382E555540C0E3538D9DB63B4040F48E562F55554090AA25709CB63B40889C5C852F555540907628C49EB63B408046CC773255554060F353D59BB63B406025325832555540C08B08439AB63B402CDF8F2A3355554090F4A37199B63B407CF72A4A3355554090F2FA039BB63B40CCE12385365555407017F4CC97B63B40A0F776603655554070EF14FA95B63B4010089F6537555540405C30F694B63B40A00C498A3755554040840FC996B63B40906D6F8D39555540F0C45DC894B63B40B091012F3855554000D85EF579B63B409034C4BC3755554000E6DD3671B63B403464BAC532555540703F639375B63B405095C2882D555540405EBE9179B63B40A441C8F72D555540508F574F82B63B4030BBE0742E555540B071A4288CB63B40B85AFFDB2D555540E08835B08CB63B403851F7422C555540A072ED1A8EB63B40643CCFCD23555540B053DC9A95B63B40A090CBE51E55554000EB4E299BB63B403C901C301E55554030E808F79BB63B40
47,Oxygenation Park,3,27,524 3 27 1 001,4,,"Long: 85.2967 Lat: 27.6708, Elev: 1280m",85.2967,27.6708,1280,"359,400.55","132,152.15","37,757",Debris Collection,Sewage management site,"Balkhu, Chovar",All year round (510 m from main road),Ministry of Agriculture and Cooperatives,Bagmati river flows near by the site,Not available,Not available,Yes (partial fencing),Yes,Yes Grasses and sparse vegetation,"Vayodha Hospital, Kritipur Clinic",Balkhu market,"Yes (APF on the way to Chovar, Police Checkpost at Chovar)",Yes (available at Vayodha Hospital),"Tribhuwan University, Modern Indian School",Disturbed roadways and garbage management issue,"Oxygenation Park is in the Bagmati River bank opposite to Tribhuvan University. It extends
to an area of 359,400.56 sq. m., out of which 132,152.15 sq. m. is found to be usable.
The site is under the ownership of the Ministry of Agricultural, Land Management and
Cooperatives. The previous study suggested the site to be suitable for debris management
and setting up camps for IDPs during a disaster. The updated survey shows that two new
bridges have been added in its vicinity, which has increased the accessibility to this site.
Numerous electrical poles have been added which will aid in camp management during a
disaster. The small ponds in the site have now been covered with bushes.",Oxygenation Park,0.026562,3.29E-05,47,0106000020E61000000100000001030000000100000092000000D4F5999AC7525540B08046DD82AC3B40309A91A0C7525540107391FC82AC3B4048F3769DC9525540E03EA12E7EAC3B40207AEDA0CB525540A017B40379AC3B40FCD8CF5FD15255402042D22762AC3B40649BCCA3D3525540C054F15958AC3B40FCDC114CD6525540A057C7B64FAC3B405CC708FED752554060C92B4749AC3B40DC787D37DA52554090B0288743AC3B4088A35104DB525540204B1D1742AC3B4088670D30DF525540609BF13443AC3B40C08331C9E2525540F02FD82441AC3B40DCF0FD7BE7525540302F17193FAC3B408C43ED63EA525540B0C9AC1A40AC3B40DCD8408DEB525540508FF52940AC3B4054995692ED52554040CAD1D73FAC3B4078B6F742F052554060C0C11C3EAC3B40F8C5D6CDF2525540B0FEA5193CAC3B40283FCE9EF352554010186D8F3BAC3B401CD934AFF352554010909A3239AC3B40E87155DFF3525540F0C15C5637AC3B407078228BF45255401085E30735AC3B409CE3C272FF525540E01C389129AC3B40047F92980053554090C387BA28AC3B404482587D0053554050751E3924AC3B40D806E5B902535540004B1EF122AC3B409C57BBD602535540705042A41FAC3B40A43A87E905535540C0B155B620AC3B408CD39EE505535540307D4C4F26AC3B407C6BCBF5035355408033CF2C35AC3B4078812A7D0A535540D056ED8858AC3B40C45EF4330953554040B9E5DB5DAC3B40E83EB7F5065355408058B8846BAC3B40E0164A1904535540F039C9A07AAC3B40BC83317802535540C051BFA685AC3B40D4CE1DA207535540B0E7DC878CAC3B406C79B3510B5355407041335891AC3B40400011CB0D535540C07DBB8694AC3B40B41A20AA0E53554020ACDD9595AC3B4000FD688211535540A0FB041097AC3B40F8C2100F1353554000E9F8DD97AC3B409887F92A13535540200ED78297AC3B402017FE481353554030F7747597AC3B40D8B24C2114535540B058353D97AC3B406042513F14535540C041D32F97AC3B407CF8E4A4145355400065422697AC3B40B49A25F8145355409010128297AC3B40084D433B17535540C07B30B599AC3B40C0596A2518535540F001EE5799AC3B40E0FB8EDD1953554080EBDF0A99AC3B408CB0945E1A5355405090232699AC3B40E421E3DE20535540406FB5188CAC3B405068CF9921535540006B6F938AAC3B40642A20392253554010CF751689AC3B40BC895DEB22535540D0F55F5287AC3B4000DB4E09255355401056505282AC3B40C87C43472553554010564BB881AC3B4010CE43BB255355403058DA1280AC3B406433A0EC265355402056CA7B7DAC3B40A08167FC27535540009732057CAC3B40780A0B4328535540505FB1F07BAC3B40D0E94FDC2953554030ECC5AE7DAC3B40D4F052242A53554000B9DE687EAC3B4054A9E5402A5355405058E5CE7EAC3B40CCF147442D535540D07BA3747DAC3B40EC38F0702F535540F02A4DA479AC3B40380C0040305355402012C1EC76AC3B40600760D8305355407043832274AC3B4000EB359532535540B0E3C0AB6EAC3B40B0B9692B345355403041E8A36BAC3B4058C80AF836535540F081180766AC3B40CCE662F637535540E0F8346765AC3B40046427BC38535540E05F990D69AC3B40201FACC138535540403837DC68AC3B40243C42B63C535540C0247A7D66AC3B40006587273C535540F04E3F9E5DAC3B4078DAE8283D53554000830D475BAC3B407C8A6BDD3D5355404090602157AC3B401C1A4E3D3E5355407082395B54AC3B40C89BA7373F5355407097C7294BAC3B40ECB92EC23F535540A0519D1346AC3B4020DD434C3F535540704C6E3B3DAC3B409861A2963E535540E0CCA22336AC3B4004ACCD3C3E535540B0D3E1C432AC3B40D46EC14B3D535540D03E56632EAC3B409C8F4EAF3C53554000438A1928AC3B4074857C4E3C535540304F9F4620AC3B40C44154793C535540D01D3AAF17AC3B403C849EA83D53554030AE7BAB08AC3B40ECB665CB3D53554040CB207E07AC3B40A8D08ECF3D535540A04C2CEAFFAB3B4060D429393E535540902BCF43EFAB3B40285E4A973D535540400AFAECEBAB3B40985BF0733C535540A077263EE8AB3B403C596B5E3B535540106ED38EE4AB3B40F04B0DD83953554030360564E0AB3B40B89AA7E33953554060EF2B9AE0AB3B40446CDE4038535540E06BF60CE5AB3B401C4B237435535540E0596DBED7AB3B40744A2CBA3453554050E2BFDDD3AB3B408C3E9AE93453554060C82EB0CEAB3B409C7795F235535540B01F2B7DC4AB3B408C4D86CB365355400079E41FBBAB3B4080A5CE8C3753554050DA3BCEADAB3B406822EC473753554010E7D2ADA8AB3B40E8E300B1365355402037174AA3AB3B40349DA93335535540909485DF97AB3B403085D553345355401016729E8FAB3B40F8FED13433535540E0D15FEC84AB3B408C83274B32535540404333737AAB3B40048057BB30535540D01CE73E6BAB3B4054C142082F53554090EBC00062AB3B407C40A8182B53554030624EF057AB3B40D00C72342953554060887FDB4CAB3B40C8CD9F392753554040F99E0248AB3B40B820C03425535540A0231E0E45AB3B4074070B262353554020073DF13FAB3B4048670E8F22535540707BE30A43AB3B40289FACC61E53554040A2186D3CAB3B4088C67B651953554000C88BC435AB3B40D82271E518535540700FDA0B31AB3B4014A464600B535540301BCB0327AB3B4010A135B809535540B0937CD22FAB3B40E4B0D6700753554050ACF7AB35AB3B402C136421FE52554070999A313DAB3B4060037862F75255400065D7563DAB3B40C4090FF9F15255405095E0A43EAB3B40B49E161DEC52554020F36E3D40AB3B40085EC5A4E4525540D06D589342AB3B40587BE317DE525540A0C8CE7447AB3B40C8CF5848D752554000C4E35D4DAB3B40F0B0293CD4525540D0C62C9152AB3B405CE20A96D252554040EEFFA857AB3B400CAE3B0EC9525540203B7C0E6DAB3B40DCCC28D0BF525540D0F5002C9AAB3B40DCF73A7DB852554030AD8F57FBAB3B40345C4611B8525540B0F90BEF01AC3B407C87A85DB752554070394B9B0AAC3B40984AD82BB7525540F07C2B3B1CAC3B406CD99AF1B7525540901C7B852BAC3B407CA6B322B9525540D05DE57533AC3B40DC5EE9C1B952554060DE96DF3BAC3B40EC6CE8A6BB52554090691C114EAC3B40141464B0BC52554040CFFBF555AC3B40604BBDE5C1525540B03502BF82AC3B40D4F5999AC7525540B08046DD82AC3B40
48,Padma Higher Secondary School,3,26,524 3 26 3 003,2,,"Long: 85.4275, Lat: 27.6733, Elev: 1335m",85.4275,27.6733,1335,"12,605.77","8,338.76",2382,Humanitarian Coordination Area,School area,Bhaktapur area,All year round,Ministry of Education,Historical sites and many temples are nearby the site,Yes,Yes (for academic purpose),Yes (Concrete wall),Yes,Yes Few trees,Bhaktapur Cancer Hospital,Bhaktapur Durbar Square Market,Yes (Bhaktapur Police and Nepal Army at Sainik School),No,"Khwopa Engineering College, Khwopa H.S.S",Waste management issues,"Padma Higher Secondary School is in Bhaktapur district. It extends to an area of 12,605.77
sq. m., out of which 8,338.76 sq. m. is found to be usable. The site is under the ownership
of the Ministry of Education, Science and Technology. The previous study suggested the
site to be suitable to be utilized as humanitarian coordination area during a disaster. The
updated survey shows three new buildings in the southern corner and one in the western
side. These buildings have reduced the usable area of the open space. This site is inside
the school premises and has a well-managed WASH facility which strengthens the camp
management during a disaster.",Padma Higher Secondary School,,,,0106000020E6100000010000000103000000010000002A000000C40083E28654554030606AB0ACB43B40C86BD12986545540401119BBACB43B40AC9F01738354554040D0C5AAADB43B40204F9FD48054554030E1234CAEB43B4014EF80E17F545540C0BEAA86AEB43B40944E9FE67F54554060FB1C2BB5B43B40C0615EDF7F545540C09F54E2C6B43B40B8AF20DE7F54554080B7C522CAB43B4038CC6EDF7F54554000BF0DD5CBB43B40800B5CEC7F54554080736C2AD6B43B405C8BDEFD7F5455407025B4C7E1B43B40ECDC6E0380545540004F34D6E8B43B406CAB29098054554000DBB96CFCB43B409C95CA6084545540A0CA2282FBB43B40644A5095885455403039983CFAB43B40B82283188854554070D09AD505B53B409498A7378C545540907A158407B53B40F8AB48FB8F545540305105C208B53B4028AD174B9054554000EC22CAFBB43B40E445E3A890545540B0209D8EFBB43B40387CCDA4905455408048B842F6B43B40746ADFFB92545540E0A4D82BF6B43B405406C2FF9254554020423A36FBB43B406423F5539654554010B8AE15FBB43B40E015664296545540003B3E52E4B43B4008FCE4E293545540C0FB6E69E4B43B40D05277DE93545540501898ABDEB43B4084E8FFA393545540F0C0D3ADDEB43B401C15FEA29354554080BDE15FDDB43B405CC9837193545540E0B4EDA3D8B43B402C18A25293545540405C36A8CFB43B40D8D9723F93545540C0CCB46FC7B43B40203A4B2D93545540504D8A40C3B43B40B8B8D81F93545540F036FBB6BEB43B40F024610293545540002CA31AB8B43B4060E431AF92545540B025B4D0A9B43B4084C693328A545540A0CECF14ACB43B401CBAE66088545540C0E69526ACB43B40E009106388545540B0617FF3AEB43B40F4EEE37187545540E0B30119AFB43B403086F1E786545540E09DF964ADB43B40C40083E28654554030606AB0ACB43B40
