SN,Name,Province,District,Municipality,Ward,Address ,"Coordinates,Elevation",Longitude,Latitude,Elevation,Total Area,Usable Open Space Area,Capacity,Suggested Use,Current Land Use,Catchment Area,Access to Site,Ownership,Special features,WASH Facilities,Wi-Fi,Boundary Wall,Electricity Line,Trees & Vegetation,Health Facilities,Market,Security,Helipad,Educational Infrastructures,Issues,Description,Name,shape_leng,shape_area,sn,the_geom
1,Adarsha Azad Higher Secondary School,3,26,524 3 26 3 003,5,"Local Name, Ward No,Municipality,District","Long: 85.4320 Lat: 27.6677, Elev: 1313m",85.432,27.6677,1313,"2,171.66","1,857.49",530,Medical Assistance Area,School Ground,Bhaktapur,Accessible all year round except in monsoon,Nepal Government,Western and southern side are covered by agricultural lands,yes,Yes (within the premises of school),Yes (Concrete Wall),Yes,No,Siddhi Smriti Hospital,"Bhaktapur Durbar Market, Sukuldhoka Market","Yes (District Police bit, Bhaktapur and Birendra Sainik Army)",No,Adarsha Azad Higher Secondary School,No,"Adarsa Azad Higher Secondary School is located towards southeast of densely populated
Bhaktapur city. It extends to an area of 2,171.656 sq. m., out of which 1,857.487 sq. m. is
found to be usable. The site is under the ownership of the Ministry of Education, Science
and Technology. The previous study suggested the site to be suitable for medical assistance
during a disaster. The updated survey shows no significant change in the usable area of
the site as there were no new structures in the area. The site is located on school grounds
and has a proper WASH facility that can be used during an emergency.",Adarsha Azad Higher Secondary School,0.00191,1.99E-07,1,0106000020E61000000100000001030000000100000017000000C82E74A0A05B5540C01713E7F9AA3B40F834A90FA25B5540E014B7B3FDAA3B40D4FE320AA35B554030BC83F5FEAA3B405CC2F158A55B5540D06FB1F2FEAA3B408C815098A55B5540806DBAE6FEAA3B40FC84F024A65B554030CCF110FDAA3B40702931B8A65B5540005B82D2F7AA3B40D4413FCEA65B554040A0DD96F6AA3B4028B4666BA75B5540C09872AEF0AA3B4000113EB5A75B554000A06D4AEEAA3B4024330E5FA85B554050DD81F6E7AA3B4090CD4E8EA95B55409063FEC6DFAA3B40741E78F4A75B5540E00AF0D7DFAA3B40C08A91F1A75B55408026F35DDCAA3B40F82ACC69A35B5540A00527A1DDAA3B40F8F33C75A35B554030C2D662E0AA3B40E0BCB6B4A35B554070452D16E5AA3B40D065AFC2A15B5540E0DCCA95E7AA3B406C59B5C99F5B55408041C09FEAAA3B40ACB3668D9F5B55406008434AEBAA3B40E4ECF5C19F5B554010F79471EEAA3B4078A023BF9F5B5540306E7789EFAA3B40C82E74A0A05B5540C01713E7F9AA3B40
2,Airport Central Dojo,3,27,524 3 27 1 001,9,,"Long: 85.3548 Lat: 27.6981,Elev:1305 m",85.3548,27.6981,1305,"21,328.91","15,045.87","4,299",Humanitarian Coordination Area,Football Ground and cultivation area on sloppy land,"Koteshwor, Naya Baneshwor, Gairigaon, Minbhawan areas",All year round,Kathmandu Municipality,Presence of International airport nearby the site.,yes in nearby buildings,Yes but secured,Yes (fences and concrete wall),Yes,Yes Dense vegetation,Kathmandu Medical College and Teaching Hospital,Sinamangal market,Yes (Nepal police at Gaushala Police bit and Nepal Army at Army Golf Club),No,Orchid College and Nasa College,Proper maintenance of football ground and remaining open spaces,"Airport Central Dojo is in the eastern side of Kathmandu Valley, near Tribhuvan International
Airport (TIA). It extends to an area of 21,328.91 sq. m., out of which 15,045.87 sq. m. is
found to be usable. The site is under the ownership of Kathmandu Metropolitan City. The
previous study suggested the site to be feasible for humanitarian coordination area during
a disaster. According to the updated survey, major areas of the site are being used for
the construction of parks and a mall. These added structures in the site have significantly
reduced the usable area and its capacity to accommodate potential IDPs in an event of a
disaster.",Airport Central Dojo,0.006748,1.95E-06,3,0106000020E6100000010000000103000000010000002B00000080592E9EAF565540A06361B615B33B40402E9D4EB0565540606CDB6811B33B403891F8B7B35655406014624CFDB23B40C05C8204B4565540C0BBEB22FCB23B4018CA3CD7B4565540600C17ABF4B23B4038141123B656554060FFD346EAB23B40C038EAB7B756554060942DC4DAB23B400CB6BBC2B856554050AD0D6ECEB23B40488C7D0FBA56554090238FC2B9B23B408824A885BA56554020DF1D2BA3B23B40D874328DBA56554080E5C0069DB23B40F435A274BA565540B043BBA287B23B407CE97505BA565540308D81DB78B23B40A4467A40B9565540603DD7864DB23B4024074DDAB856554020B6C39C52B23B4004F66652B8565540A0EC670B55B23B402C9B7958B7565540B0ED9B8457B23B40B8D19979B6565540F07ED28059B23B4070F3798BB5565540A0006D5D5BB23B40E8627B2BB5565540F0ACE95C5BB23B408824A584B456554070F6DD675DB23B406409683DB3565540E031983565B23B40C4912731B156554000EDDAAF71B23B40944CD628B0565540002A181D7BB23B40F0BA76D5AE565540605D218881B23B40406CF3CAAC565540404C3F6992B23B4034213282AB565540D030672BA1B23B400C2289CAAA565540E003B9CDADB23B4084FDD78DAA565540C00A919CB4B23B40EC34DD00AA565540006EAC8ABFB23B40707DF7FEA9565540C03A0C19D4B23B40D821AF22AA565540E0F6ECDFDEB23B4064F5C079A9565540F01CFCDCE8B23B405868B778A9565540908713EFEEB23B4030A1BAB5A956554020EF88EAEFB23B4024E298BEAA565540A05024E3F0B23B40E03BE2D1AB565540502FA65FF2B23B40C48D326CAC565540B05AFA55F4B23B40A4B69A9BAC565540E08B6CCBF5B23B4094034ACEAC565540906EACE6F8B23B40ACF9F30EAD5655401084A64603B33B408CFD9723AE56554090A832A40BB33B4080592E9EAF565540A06361B615B33B40
3,Airport Golf Club,3,27,524 3 27 1 001,8,,"Long: 85.3607 Lat: 27.7095,Elev: 1325 m",85.3607,27.7095,1325,"176,853.64","122,758.13","35,074","Military Installation, Civil Mil Coordination Center, Warehouse, Humanitarian Coordination Area","Playground (golf), Training Area",Areas surroundaing Bauddha,All year round (difficult during monsoon),Pashupati Development Trust Board and Civil Aviation Department,Water supply is plentiful and each golf club contains a limited catering facility,yes in nearby buildings,Yes but secured,Yes (High fences),Yes,Yes (Both dense and sparse vegetation in different parts of the site),Siddhi Smriti Hospital,Mitrapark and Gaushala Market,Yes (APF Camp and Nepal Police at Airport and Gaushala bit),Tribhuwan International Airport,"Peace Nepal, Texas, Orchid",-,"Army Gold Club is located adjacent to Tribhuvan International Airport (TIA). It extends to an
area of 176,853.64 sq. m., out of which 122,758.135 sq. m. is found to be usable. The site
is under the ownership of the Pashupatinath Area Development Trust Board and the Civil
Aviation Department. The previous study suggested the site to be appropriate for multipurpose
use including military installation, civil-mil coordination center, warehouse and
humanitarian camp during a disaster. The updated survey shows that few structures were
constructed in the area. An addition of five buildings in the south-west corner of Army Golf
Club has reduced the usable open space area. As the site is guarded by the Nepal Army,
a detailed inspection of the site was not allowed. Consequently, the survey team could
assemble limited information about the site.",Airport Golf Club,0.022236,1.62E-05,29,0106000020E61000000100000001030000000100000054000000ACF712C2BF5655403039F4BC8CB53B40C49042BFBE565540105E3C1596B53B4054D13853C1565540901D9D6491B53B40C050594EC456554060A3F3668CB53B406CE160D1C8565540309E3B9786B53B40E09A2B01CB565540C073CDF285B53B40C0444DCCCC565540A0DFFB6988B53B40D091AB3DCD565540E011166089B53B40E8372F8ECF565540E081D7FB90B53B402C13C245D2565540E05B6E6198B53B4090A34A9ED3565540200F13F09AB53B40C467C76FD5565540E046E22B9CB53B40947C11B3D656554030E896999BB53B4084DA1FFFDB565540D09DECC795B53B405C7D9F11E056554020D31FFD90B53B404C34D0B3E4565540A06B96998DB53B400C81AF72E5565540001DBDAB8EB53B409C9AAF0EEA565540001B4BDC96B53B4094070120EF565540706025BB9FB53B40DCCBE9B4F556554010351A32ACB53B405C48C37DF856554080EE97B2B1B53B40546EF137FC5655405012B6C5B9B53B40C0AAD6E3FE56554080FA9E59C1B53B405C06B7FD00575540908216B1C9B53B40F04FAE190257554000C10138D1B53B4094E2450802575540502F3578D8B53B40BC42336F015755406063E9EDE3B53B4090E666CF0057554050772044F0B53B40F0711EBD0057554090C8D81AF8B53B4014FE2E7C01575540E0C49D1F04B63B409CBD9A7702575540301B0A3D0EB63B405CC1299C035755402098BFAD13B63B40208E2E6605575540408021E318B63B40081405940757554000149E9A19B63B409097FA2E0A57554070D2C63E1DB63B40E4E06BED0C5755406056C06120B63B407009FE860F5755407090BA4622B63B40C85C7443125755405057DFEA22B63B4058DD092215575540A082A24E21B63B40ECDB27E319575540708782201DB63B40A4706C401F57554020D4242F12B63B405CAE170822575540D03D7A560AB63B40D886B95F255755404011F3F702B63B40BCAA7B052857554060298C9FFDB53B40B876FD0C2D57554020EA5BAFF7B53B409C7A90BA31575540C06ED182F1B53B4004F5BAF337575540D0153D46ECB53B4074F95C5D3F575540D031F83DE6B53B403C1D28374257554010247AA4DEB53B403874C9674B57554030A6883FC2B53B400430890A535755408070ED01B7B53B4098314C9C4D575540601DFC7B8EB53B40F4A4BEE43C57554040FCB19E58B53B40D4AF558334575540805EEC662AB53B40DC3BBE3630575540B00CD37A29B53B4028FCFEB52E5755403052F44D38B53B40EC5DDA8F2C575540701CAB804DB53B40B4D97DCD2B57554050D4C3FD54B53B407CDB222A2A5755408091C4D55FB53B40F0138DB226575540C07211D367B53B4098F4B72423575540A03BF1B36EB53B40ECC5E45E1C575540E06530FE60B53B405826967C18575540209446E957B53B40E49FB22B0E57554050D6BA9254B53B40C41BCE810A575540201533BA4EB53B4074866D23025755406099265246B53B40388AC220FA565540504A5F6540B53B40A40281DDF456554010510BDB3EB53B4064F592C4F056554010D3DCCC47B53B405C7234DDEC565540D01E301E4BB53B40D07895C5E8565540B012F8BA4EB53B40A0CA7E36E5565540702E1D6652B53B40A84E3576E25655405053BB2955B53B40C0D5E126E0565540D078EC0657B53B40CC06A4E5DC565540406432CD58B53B405CDC5920D3565540D06B06785DB53B40C09789DACC56554020A60CA15BB53B400093FD72C5565540C077DF2C6AB53B409474E1BCC456554050C0DC7E6EB53B40F85EC406C4565540509FE5D072B53B409040A850C3565540E0E7E22277B53B40883C899AC2565540E0C6EB747BB53B408408502EC156554070EEF11884B53B40ACF712C2BF5655403039F4BC8CB53B40
4,ANFA Football Ground North,3,25,524 3 25 1 001,17,,"Long: 85.3300 Lat:27.6620, Elev: 1284 m",85.33,27.662,1284,"18,238.22","14,475.51","4,135",Settlement Camp,Football ground,Patan area,Access to Site,ANFA,Bagmati river flows in its vicinity,yes,No,Yes (Fences and concrete wall),Yes,Yes Sparsely distributed near river side,"KIST Hospital, Norvic Hospital, Civil Hospital","Patan Market, Baneshwor, Gwarko market","Yes (APF satdobato and Metropolitan Police Station, Satdobato)",Tribhuwan International Airport,"Himalayan College of Engineering, Pulchowk Engineering College",Waste Management,"ANFA Football Ground (North) site is located nearby the dense settlement of Patan with its
proximity to Bagmati River. It extends to an area of 18,238.22 sq. m., out of which 14,475.51
sq. m. is found to be usable. The site is under the ownership of the National Sports Council.
The previous study suggested the site to be suitable for settlement camp in the event of a
disaster. The updated survey shows some structures added in the site. A building on the
eastern side, extension of the existing bleachers on the southern side, a new bleacher on
the western side, and two newly built gates have reduced the usable open space area and
its capacity to accommodate people during and after a disaster.",ANFA Football Ground North,0.005686,1.67E-06,4,0106000020E6100000010000000103000000010000001000000000F5E23C4F555540B0540FFC83AD3B40B827655B52555540402042249FAD3B403066666B53555540504C558DA8AD3B40F4B2EA9C5D5555407032448BAAAD3B40FC348C6A70555540C039A8B28AAD3B401883904B72555540D0D3922087AD3B408484E57074555540A06DD70B80AD3B4058513A7375555540D0262FDE7AAD3B4098F738ED73555540A006199171AD3B4008B79E4E73555540C0DDC1C86DAD3B4030DA11DF7255554030B0B51F6BAD3B40F80D1E6A6E5555400041E64B52AD3B405CFA41E76A55554090ED11F159AD3B4098DDDE9E5C555540802BD78972AD3B409C5121B156555540E09E177D7BAD3B4000F5E23C4F555540B0540FFC83AD3B40
5,ANFA Football Ground South,3,25,524 3 25 1 001,9,,Long: 85.3342 Lat:27.6778 Elev:1318 m,85.3342,27.6778,1318,"11,405.23","10,368.82","2,962",Vulnerable Population Assistance,Football ground,Patan and Satdobato area,All year round,ANFA,Bagmati river flows in its vicinity,yes,Yes (official purpose),Yes (concrete wall),Yes,No,"KIST Hospital, Norvic Hospital, Civil Hospital",Satdobato - Gwarko market,"Yes (APF satdobato, Metropolitan Police Bit and Nepal Army on the way to Hattiban)",Tribhuwan International Airport,"B&B Medical College, KIST Medical College, MOHLISS College",No issue,"ANFA Football Ground (South) is in the southeast corner of Kathmandu Valley. It extends
to an area of 11,405.228 sq. m., out of which 10,368.818 sq. m. is found to be usable. The
site is under the ownership of the National Sports Council. The previous study suggested
the site to be feasible for vulnerable population assistance area during a disaster. Changes
observed during the updated survey include the addition of newly built structures: two
buildings near the entrance gate and commentary section office, a generator building and
bleachers in the new site have reduced the usable area of the open space. However, the
electric lights installed in the site aids in camp management during a disaster.",ANFA Football Ground South,0.004756,1.04E-06,5,0106000020E6100000010000000103000000010000001A000000709E60C10B555540501E062F81A93B4054B18F280C55554040A7DE1283A93B40C481CBBB0C555540204E32C585A93B40683765CD0D555540A0800CC88AA93B4024B7D7880E5555403019A5898EA93B40CCEECD1C105555406000056A89A93B4008C9B5CA10555540401E963987A93B40D40EA420125555403050B7EB82A93B40A44C14281255554040C113D382A93B4024C0E5BD17555540A021E85D9FA93B400CB48DAD19555540C001BF879FA93B40C896C9A620555540301818A48CA93B4048A83B262155554090EA38658FA93B408449BEF7245555402094D78C83A93B408C2071532955554010F8AC1C79A93B40C4C4267727555540003ABA4563A93B4020E184572655554050E8B7E25CA93B4030A15369255555401032C99857A93B409C494A7824555540E048518653A93B40B0A0E6A622555540F085575556A93B40341ABE4122555540505F3A0455A93B4024C0EFF118555540D07F296065A93B4054B6DD251955554010A3A72467A93B40386BAB070F555540C07D20337AA93B40ECFCE0790D555540800D31857DA93B40709E60C10B555540501E062F81A93B40
6,Bagmati Corridor 1,3,27,524 3 27 1 001,6,,Long: 85.2920 Lat: 27.6704 Elev:1275 m,85.292,27.6704,1275,"16,054.67","13,027.18","3,722",Settlement Camp,"Bagmati river is used for irrigation, open space for parking purpose","Kathmandu, Lalitpur and Kirtipur",All year round,Kathmandu Metropolitan City,Bagmati river flows in its vicinity,No,No,Yes (fences and concrete wall),Yes,Yes Sparse vegetation and trees at roadside,"Vayodha Hospital, Kirtipur Clinic",Balkhu market,Yes (APF Chovar and Nepal Police near Chovar),Yes (Vayodha Hospital and Star Hospital),"Modern Indian School, Tribhuvan University","River Waste Management, Garbage Management","Bagmati Corridor 1 is located close to Tribhuvan University, southwest of Kathmandu
Valley. It extends to an area of 16,054.67 sq. m., out of which 13,027.18 sq. m. is found to
be usable. The site is under the ownership of Kathmandu Metropolitan City. The previous
study suggested the site to be feasible for settlement/camp during a disaster. The updated
survey shows that three new buildings have been constructed in the site, reducing the total
usable open space area. However, a wall built alongside the river from north to south aids
in the camp management by reducing the flood risk.",Bagmati Corridor 1,0.008731,1.47E-06,6,0106000020E61000000100000001030000000100000030000000604BE506A7525540601809C713AC3B40F896B20AA552554090BEB35E1AAC3B408804A302A55255403095FC081BAC3B40A42B2804A552554010BC39061BAC3B40B00A3678A6525540207DF38B18AC3B4034769A26A7525540F050D3CD15AC3B409C6222BCA8525540104DEC4D12AC3B40349C4282A952554060446A0010AC3B40FCCDA07DA952554080C2F36A0FAC3B40BC8F9739A9525540B08EB1DA06AC3B40F8300B3DAB5255408005710EE7AB3B40F4EC5E93AE5255402016313AC0AB3B40C428BB59B3525540B02A173F9CAB3B40D820D337B6525540C048442680AB3B40A0A6D5CFBC525540F0B1C2805DAB3B4030F50290BA52554090F8E6F957AB3B40045B34CEB852554070C8906361AB3B4040122E49B7525540F0D9988769AB3B4054B30FBAB45255409092083D77AB3B40204CBB6AB352554040E9E9607CAB3B4048DF4FBEB1525540605CE4707CAB3B40CCBB7DB0B0525540208093BF79AB3B405C16F6B3AF525540B0CEE54E76AB3B40385D1FB6AE52554070F1312171AB3B40407CA11BA9525540C07934B78DAB3B405C13893AAC525540608F3B6C91AB3B40C8DDF486AA52554070CDE5899EAB3B4044F245FEA952554040445DCFA5AB3B408C345F2AA952554080B41EE2ADAB3B4000709CDDA852554010A6A33BB9AB3B40C8622133A85255404031C263B9AB3B40A8A0E60CA8525540B0F37B3CB9AB3B40FCBD7E99A3525540A01076F2B3AB3B4098EDF0CC9E525540D0E53120C0AB3B40B01FCE7A9E525540D0964DFFC1AB3B404CA4D4589F525540B08E5065C8AB3B4008F5D9789F525540202D07A6CBAB3B408488D2E39F52554050A93CDDD6AB3B40045580DB9F525540C026BC05E2AB3B40748A6FFCA552554050EA5D20ECAB3B40AC0B6E13A5525540C030F4E7F6AB3B4020735405A452554000F45953F9AB3B40602132E5A2525540E016F74DFBAB3B4038D76E78A15255408093A213FFAB3B40905C92DFA2525540C01B4E7F08AC3B4090FE31C2A35255403016D0D70EAC3B40680DCD6BA5525540D004AC070CAC3B40604BE506A7525540601809C713AC3B40
7,Bagmati Corridor 2,3,27,524 3 27 1 001,9,,Long: 85.2922 Lat: 27.6741 Elev: 1275 m,85.2922,27.6741,1275,"19,450.13","18,795.18",537,"Settlement Camp, Logistics","Playground, refreshment area","Kathmandu, Lalitpur and Kirtipur",All year round,Kathmandu Metropolitan City,Bagmati river flows in its vicinity,Not available,Yes but secured,Yes (fences and concrete wall),Yes,Yes Sparse vegetation and tress at roadside,Vayodha Hospital,Balkhu market,Yes (APF Chovar and Nepal Police near Chovar),Yes (Vayodha Hospital and Star Hospital),"Modern Indian School, Tribhuvan University",-,"Bagmati Corridor 2 is in the southwest of Kathmandu Valley, near Tribhuvan University. It
extends to an area of 19,450.13 sq. m., out of which 18,795.18 sq. m. is found to be usable.
The site is under the ownership of Kathmandu Metropolitan City. The previous study
suggested the site to be suitable for settlement/camp and logistic hub during a disaster.
The updated survey shows three buildings added on the northwestern and eastern side
of water tank. Some land area in the northeastern side was occupied by being used as
garage. A bridge was constructed to connect Bagmati Corridor 2 with Oxygenation Park,
thus increasing the accessibility to the site. The addition of a few structures has reduced
the usable open spaces of the area.",Bagmati Corridor 2,0.007305,1.78E-06,7,0106000020E61000000100000001030000000100000016000000001C2C669F52554030AC467C23AC3B40CC8DBCC7A452554060AE656F52AC3B40E45118DCAA525540C082DDD287AC3B40546BFEEDAE5255409099A6C9A7AC3B4000AEB568B2525540B0627622BEAC3B4064763243B452554030F76BE0BDAC3B40DC447DDBB652554020F8919CBBAC3B40800A8891B8525540405584F8B9AC3B40741102E2BB5255408002C9ADB7AC3B4028C0AF24BE525540F0D640A3B4AC3B4088BCEBC9C252554030F13408ADAC3B40F8AAE31DBE52554060DF673DA0AC3B4080B728C5B752554040113CF989AC3B409829B624B452554030BC6A9E78AC3B4030224CB4B25255401075D8FA6FAC3B409CE3DE58B0525540E0775B9665AC3B4044AF84C8AB525540B0A1D61334AC3B40385ECE69A9525540609CCB4B10AC3B4034769A26A7525540F050D3CD15AC3B40B00A3678A6525540207DF38B18AC3B408C3C7E82A25255406038EF881FAC3B40001C2C669F52554030AC467C23AC3B40
8,Bagmati Corridor 3,3,27,524 3 27 1 001,10,,"Long: 85.2946 Lat: 27.6757,ELev: 1275m",85.2946,27.6757,1275,"43,787.67","31,766.64","9,076",Settlement Camp,"Playground, refreshment area","Kathmandu, Lalitpur and Kirtipur",All year round,Kathmandu Metropolitan City,Bagmati river flows in its vicinity,Not available,Yes but secured,Yes (fences and concrete wall),Yes,Yes Sparse vegetation and tress at roadside,Vayodha Hospital,Balkhu market,Yes (APF Chovar and Nepal Police near Chovar),Yes (Vayodha Hospital and Star Hospital),"Modern Indian School, Tribhuvan University, St. Marys School and St. Xavier's school",-,"Bagmati Corridor 3 is in the southwest of Kathmandu Valley, near Tribhuvan University,
along the bank of Bagmati River. It extends to an area of 43,787.67 sq. m., out of which
31,766. 64 sq. m. is found to be usable. The site is under the ownership of Kathmandu
Metropolitan City. The previous study suggested the site to be suitable for settlement/
camp and to be used as a logistic hub in the event of a disaster. The updated survey shows
temporary settlements in the bank of river. The temporary settlements consist of eighteen
buildings, four construction sites and a petrol pump. Being located in close proximity
to the river, the entire area is vulnerable to flooding. The addition of temporary and
permanent shelters has reduced the usable area significantly. With the reduced usable
and the vulnerability to floods, this updated survey concludes that the Bagmati Corridor
area is less favorable for settlement/camp during a disaster.",Bagmati Corridor 3,0.00985,4.00E-06,8,0106000020E61000000100000001030000000100000014000000A0829E12C352554050D13FCFADAC3B406C711308C0525540104739FDB4AC3B4070A73DF7BB525540B01A83F2BBAC3B40A02F28DDB9525540A042675FBEAC3B40E81CDFEAB552554030E8121AC1AC3B4078F06AE3B352554080331CDFC5AC3B400C87906DB452554020487B13CAAC3B409CD9C1C0B8525540E0363CFFD7AC3B40CC4BD5D5C452554040F68A96F5AC3B4074BA991FD05255409071FD0812AD3B4008299A19E6525540D06C8D9A48AD3B401C957204FA52554070BE52CF11AD3B40947A78AEF15255400050FF02FEAC3B40B88C8402E9525540A003AB5BEEAC3B4068683A0FDF525540905006EDDDAC3B40643A5969D8525540906C6577D2AC3B4038A756C9D3525540D0EDFDECCAAC3B409C947621CB525540E0BFA0A4C0AC3B40800616E9C752554060DD320EBBAC3B40A0829E12C352554050D13FCFADAC3B40
9,Bagmati Corridor 4,3,27,524 3 27 1 001,12,,"Long: 85.3031 Lat: 27.6925, Elev: 1277m",85.3031,27.6925,1277,"15,994.22","15,955.09","4,558","Debris Collection, Dead Body Management/Morgue","Park, Crematory area","Kupondole, Sanepa and Kalopul area",All year round,Kathmandu Metropolitan City,Bagmati river flows close to the site,yes,Yes,Yes (fences on all sides),Yes,Yes Sparse vegetation,"Teku Hospital, Vayodha Hospital",Teku market,Yes (Metropolitan Police at Teku and Sanepa),Yes (Vayodha Hospital and Star Hospital),"Nightingle School, Advanced Engineering College, Sagarmatha Engineering College",Waste and Sanitation Issues,"Bagmati Corridor 4 is in the southwest of Kathmandu Valley, along the Bagmati River.
It extends to an area of 15,994.22 sq. m., out of which 15,955.09 sq. m. is found to be
usable. The site is under the ownership of Kathmandu Metropolitan City. The previous
study suggested the site to be suitable for debris collection and dead body management/
morgue during a disaster. The updated survey shows new buildings in the site which have
reduced the total usable area of the open space and hence, less accommodation capacity
during an emergency. However, the addition of electrical poles and fences around the site
strengthens its capacity for camp management.",Bagmati Corridor 4,0.006923,1.46E-06,9,0106000020E610000001000000010300000001000000520000007057A2124D5355409039C56633B13B40949803684D535540E0B0689C35B13B40FCDE37B04D53554000B8674A36B13B40547220C54E535540308F52DC37B13B405C67CDB24F53554040ADB39738B13B40A8C366B550535540B0A804D937B13B4014FB4659515355404015119034B13B40846ECFE9525355402049501F37B13B408833AF485353554020A60FEF31B13B40E4A27BC354535540D0C7E54433B13B40E42E54D454535540E0F53E7B3AB13B40302BE65C56535540E03201573DB13B40B4874828585355402099166041B13B40C0FDCCD55A5355402020CD3447B13B401078DD0C5D535540706C2F424DB13B40CCEA2D015D535540505E5A3E4EB13B40609904AD5D535540A020F35952B13B40B85263915E53554000EB0EE654B13B402CA04BE96053554020881D2F58B13B4054888F82625355408049B0C35CB13B404468FCE962535540E091ECF75FB13B40088E9D2366535540A0EEA28464B13B4030E1349E67535540208FF25367B13B4060ADF3FD66535540D02E9E2B6EB13B40785FF6B6675355402096EEE06FB13B40DC9B9F1A6A53554020A48EBF70B13B400CD468AA6A535540A01EEB9472B13B40DC3BEA616B535540D0AEC3AE72B13B40D8708A6C6B535540704F77A673B13B40647BBE5B6C535540002797D473B13B40B40621776C535540E046C54474B13B40B02F8AA66D535540E051593974B13B407C82F1A66D535540C06C5AC174B13B40642BE5926E535540B06077B874B13B40B0D813476F535540103A649B74B13B404C0841EE70535540605D758B74B13B401431652A71535540807A978874B13B400060174272535540C0AB2ECD74B13B4088C34F637253554060D0987C76B13B40D439EF2273535540C082627576B13B40B41600687353554060DCB95678B13B40FC461F2F7553554080FE954578B13B401035416576535540E08F658F76B13B40702C55447853554020F1597D76B13B40441109A77853554020CA31F975B13B405C275CF978535540507408356FB13B401055037979535540F037AEA160B13B40287D320C775355401080E75D5DB13B40D410A9297653554090DF4DF05CB13B40B86A597674535540601C07A95BB13B4070B820207153554070C7B3E056B13B402844D1616F5355406097C00A53B13B4010E523416E53554020ED553B50B13B40841B19F96C535540D0CEB6374DB13B400C319B606C535540E08C3F044BB13B40246A53FE6A535540F0EFD33C45B13B4084EFCD486A53554020D9528244B13B40C064F10169535540405A080C43B13B401079815B67535540A02340DF3EB13B40ECA1C6CC6653554090B6B7973DB13B404854E93166535540C0271F3B3CB13B40DC800C006553554010288FA736B13B40CCF8FFE36353554070866EFF31B13B4060AECA0963535540609D01A92CB13B400459A33462535540507EB5012AB13B4050EACD7361535540C0022A4D26B13B40544C48AD60535540D0B6F00E23B13B40C08BD0905E5355408079BD5E1AB13B40C8BC97E95B53554090E642A515B13B4048BA92985A5355407067B3B316B13B40E46C7492595355409010771317B13B4048173C67585355409025ED4716B13B408CFDC0A157535540C0D9975D18B13B40E8AAEDCC56535540400FE81D1AB13B40B07D345C565355400075C99B1CB13B40C8A8274C55535540403F77CB1FB13B408C77921853535540207BCA5D24B13B40EC97057B51535540304DB1E827B13B407CB38B4E50535540E048E26B29B13B405CC9E6D44F535540005D0D152CB13B407471D5C14E535540F030D6442FB13B407057A2124D5355409039C56633B13B40
