19,Birendra Sainik School,3,26,524 3 26 3 003,1,,"Long: 85.4185 Lat: 27.6725, Elev:1333.81m",85.4185,27.6725,1333.81,"67,089.77","64,589.20","18,454","Civil Mil Coordination Center, Warehouse, Medical Assistance Area, Helipad, Humanitarian Coordination Area, Vulnerable Population Assistance, Telecommunication, Portable Water Source",School sports and military training area,Bhaktapur,All year round except for monsoon season,Nepal Army,"It has historical pond, Sidhhapokhari nearby, water treatment plant within the boundary and fire brigade office nearby",yes (presence of purifying water plant),Yes in the premises,Yes (concrete wall and fences),Yes,Yes,"Bhaktapur Hospital, Organ Transplantation Hospital",Siddhapokhari market,Yes (Nepal Army within periphery),No,"Bhaktapur Bahumukhi Campus, Birendra Sainik School",-,"Birendra Sainik School is located along the main road leading to Bhaktapur City. It extends
to an area of 67,089.77 sq. m., out of which 64,589.20 sq. m. is found to be usable. The site
is under the ownership of the Nepal Army and the Ministry of Defense. The previous study
suggested the site to be suitable for multiple purposes including civil-mil coordination
center, warehouse, medical assistance, helipad, humanitarian coordination, vulnerable
population assistance, telecommunication and for accessing potable water during a
disaster. The updated survey shows the addition of two buildings and two restrooms which
have reduced the usable area of the site. Likewise, the area is within the school premises
and has a well-managed WASH facility which is a key factor for the people residing here
during a disaster.",Birendra Sainik School,0.013952,6.13E-06,19,0106000020E61000000100000001030000000100000028000000A8CE86E2985A554030A3ED81F8AB3B4068CA97309C5A5540C0B5455928AC3B40F444F27C9C5A5540D0C3B49B2EAC3B4028BB82D6A55A5540E0BDD1EC2AAC3B406CAA1546AE5A5540501E773D2BAC3B40186ABFF1BB5A55401035663439AC3B4008EFEB8DC05A5540B063C0F768AC3B4034C7D70CC15A5540005E83CB68AC3B40785F998FD45A5540C05296F368AC3B40908C859DD45A554060CD108560AC3B4048AEDFC8D55A5540E046246860AC3B408CBCF6AED65A5540C0160B3B60AC3B40B012F16EDA5A5540E04F83F65EAC3B404848C24AEB5A554010A475525CAC3B4040019F6BED5A5540C0D6237359AC3B40C074ECB3EF5A554040EA0CD455AC3B40C0BDFEF4F05A554040D3EA3052AC3B4080815EB4F25A554090A5A36045AC3B409C07B394F35A55406088E8353BAC3B406C3112F5F45A554020F8AA8B31AC3B40FCB576D9F55A5540C04C6A492CAC3B40CCB365BAF55A5540E02ADD092BAC3B407C1286F3EE5A554040E864602AAC3B403C6BBE5BE75A5540301E91502BAC3B406CFDCF0DDE5A5540E03308FB28AC3B40748EF23AD65A55408095AEAF28AC3B40DC838203D55A5540F0A1F55727AC3B4088313815D55A5540904BBF7018AC3B4068F5EA1DD55A5540C0CEB78FF2AB3B403C2544B6D45A5540E034D042EEAB3B40E0A7B727D45A55404093025CEBAB3B40EC1B112BD35A55401093BF79E8AB3B408C64CB99D15A5540D0F3F76CE7AB3B40F44CDA1CCB5A5540D07F4063E8AB3B4050FF3973BD5A5540D070C2CDECAB3B406870E692BC5A5540A02C0AF0ECAB3B4090E59354B55A55400021ED15EFAB3B4098417F29B35A5540904658B2EFAB3B40146CAF0CAB5A554000F86329F3AB3B40A8CE86E2985A554030A3ED81F8AB3B40
20,Civil Aviation 1,3,27,524 3 27 1 001,9,,"Long : 85.3535 Lat : 27.6984, Elev: 1315m",85.3535,27.6984,1315,"17,457.82","13,767.11","3,933",Settlement Camp,Football ground and some cultivation on sloppy land,"Koteshwor, Naya Baneshwor, Gairigaon, Minbhawan areas",All year round except for monsoon season,Tribhuwan International Airport,Tribhuwan International Airport is nearby the site,yes in nearby buildings,No,Yes (concrete wall and fences),Yes,Yes (dense vegetation),"Kathmandu Medical College, Teaching Hospital",Sinamangal market,Yes (Gaushala Bit and Near Army at Golf Club ),Tribhuwan International Airport,"Orchid College, Nasa College","Improper management of Football ground, open space management issue","Civil Aviation 1 (Sinamangal) is located close to Tribhuvan International Airport (TIA), east
of Kathmandu Valley. It extends to an area of 17,457.82 sq. m., out of which 13,767.110 sq.
m. is found to be usable. The site is under the ownership of the Civil Aviation Department.
The previous study suggested the site to be suitable for settlement/camp during a disaster.
The updated survey shows no major changes besides a newly constructed building which
has slightly reduced the usable open space area.",Civil Aviation 1,0.005973,1.60E-06,20,0106000020E61000000100000001030000000100000047000000E487820297565540C0494DD7A0B23B4004156011965655409000CF3AA5B23B4088DF61129556554030BEDCDEA9B23B40F8DC59B094565540C08B8207ACB23B4064AFC72094565540B01A64F1ADB23B4040CED8909356554080D24A6AAFB23B409CF422E592565540E0638C22B0B23B40D88351F591565540209E33BDB0B23B40147481C19056554000CB7E5AB1B23B403C633A218E56554040E8D87DB5B23B405C1461BC8E565540A0B026CDBAB23B40F0F152428F565540D060D3D9BEB23B400423D5968F56554010FDD167C1B23B408C37B41790565540A0B707BFC5B23B40E03BBDCB90565540201A3AD1C9B23B4074C8612D91565540101949C3C9B23B40BC879EAE91565540D0E0E55CCCB23B406800B94F92565540D0A21AD9D1B23B40F4B40F9292565540C095257CD6B23B40A0F8D1B592565540501E9DC1DFB23B40F00E7EEB92565540E0B35D36E3B23B403C5C354093565540B01EEE60E7B23B4030C1486D93565540D0385113EAB23B403427C9D293565540B0B082C8EAB23B40D4A0A16D9456554020F262D0EAB23B4078F6BE8594565540302F8E6EECB23B401CF0FA8494565540C0EA6112EFB23B40CC818CEC94565540E0D77D39F4B23B4058ACFEA195565540402F366AF8B23B4020013C0296565540F08370B9F9B23B407C0516B396565540C066ACC2F9B23B4030E231B59856554040BAE746F6B23B40681598AE9A56554080BB763CF3B23B40B437BE2A9C565540E081C55BF2B23B40847E07DA9C565540A0F6F0D1EFB23B40A8700AF59C5655408055B57CEEB23B406816BFE29C565540F08667D3ECB23B40B86838D49C565540F04DFAD3ECB23B404488C4D39C56554010EE7940ECB23B407CD0C5D09C5655402015CDB5E9B23B4008F051D09C56554050165B23E9B23B40F41BF8FD9C565540204E9321E9B23B4090262FFE9C565540E0D75268E9B23B401C264EACA0565540F043C65AE9B23B40387B28E3A0565540807FE6E9E9B23B4028A1B42BA1565540C020DEC2EBB23B40983D4AF6A156554050D118D8EDB23B4060533798A556554070717375EEB23B408C3BBC13A8565540502A026FEFB23B4008066297A8565540D0789C03EFB23B40E46748A5A8565540F02FF8A6E9B23B40B8A5701FA9565540D0619794E3B23B40C006196FA9565540206EEE1BE1B23B4000A9BF73A956554030F3C67DDCB23B4028A7B676A9565540D06E8E8AD9B23B4030E57F61A956554070369BA2D5B23B4064272B31A9565540A085F8DBD1B23B4034C44759A956554030BBA3C1BFB23B40BC1DF51DA856554000929EBBBFB23B40188EF499A756554010880ED5B6B23B40BCFA62E0A75655406036CA379DB23B400C3B5684A0565540A06699C69FB23B40A87FBD17A1565540205B6A74A8B23B40D4AE8FDBA0565540C03024A0ACB23B40A0B78EDBA05655401030175DB2B23B40C4013B579D56554010B88A4BA9B23B40D88CD9439D565540C0FCBBB8A7B23B4014D2166C9856554060269854A6B23B40847DCC3D98565540609211F2A3B23B40ACB696BA97565540F087EB47A4B23B40E487820297565540C0494DD7A0B23B40
21,Civil Aviation 2,3,26,524 3 26 3 003,32,,"Long: 85.3488 Lat: 27.6749, Elev: 1305m",85.3488,27.6749,1305,"142,215",117155.44,"33,472",Warehousing,Playground and navigational beacon,Koteshwor,All year round,Civil Aviation Department,The area is completely fenced and guarded by Army,yes for related stakeholders only,Yes but secured,Yes,Yes,Yes,"KMC Hospital, Tilganga Hospital",Tinkune-Koteshwor Market,Yes (Gaushala Bit and Near Army at Airport),Yes (TIA),"Koteshwar Saraswoti Ma. Vi, Nawajyoti H.S.S, KMC Teaching Hospital",Security issues may arise due to its proximity to the airport,"Civil Aviation 2 is in the southern end of the runway of TIA. It extends to an area of
142,215.32 sq. m., out of which 117,155.44 sq. m. is found to be usable. The site is under
the ownership of the Civil Aviation Department. The previous study suggested the site
to be suitable for warehouse during a disaster. The updated survey shows the addition
of only a few constructions in the open space. This includes a badminton court in the
southwest part of the site, electrical poles and a tower in the southwest part near the
track, which have reduced the usable area of the open space. However, the electrical poles
installed in the site can be useful during camp management.",Civil Aviation 2,0.01542,1.30E-05,26,0106000020E6100000010000000103000000010000004D000000D0947B1356565540B001239E86AD3B40CC0C198C5B565540F03C79EC81AD3B40501CB5AB5B565540F0CFAFD278AD3B40B8DC4D865C565540901A931B64AD3B40E8C1927A5D565540A0F6171359AD3B401C8FE3595F56554020566B6E45AD3B40985CEC226256554060327C7E2FAD3B40A073310C63565540B0627D312AAD3B4078AD7BB263565540609F6B9826AD3B4050AFFEC865565540E060B6471AAD3B40943F9A8968565540D013902D0CAD3B4048977A116B565540B0FAF6C901AD3B4038705E4A6D565540F0E6795EFBAC3B40A0DDE26E6F565540E087F62EF6AC3B4098D0AC2F7356554050BCC2D5EBAC3B405C372AE975565540709A3CC9E5AC3B4064CA66597556554020A43493E1AC3B4004F3E79B74565540C09D31C1DEAC3B4058C511197456554060BB9316DCAC3B402C8D198673565540E0A2A6CED3AC3B4044264E1D73565540F0C90511CDAC3B40E4962FEC72565540B02FBA24CAAC3B40E44AC49970565540F0FA246EBEAC3B40641367CB6E565540C0790FEEB6AC3B40A07A0D646D565540901BC87BACAC3B40349079526C565540A0A27DE8A6AC3B401C97C3276B56554080698B239FAC3B404812828A6A565540609776A698AC3B4030CB1A406956554090D6D6CA8DAC3B4054F00CD567565540E00FF19F7EAC3B4078C6101567565540E07B4CA178AC3B404CA87FCE6856554030CD426974AC3B406071B0F768565540B0730AAC73AC3B401CDB8F066656554080B0E23165AC3B407014FD0463565540009ED61F58AC3B40ACC78F3C61565540C045AB9352AC3B40B0681CDB5E56554010F808C94DAC3B40A0804B385D56554080222F684BAC3B4010D5F78E5956554030FDAA4048AC3B403878590457565540C052955441AC3B4004B3E2F05456554040F4A43E3BAC3B40D42AA3485056554010ECB4823AAC3B40506A24094C5655404081F3BB3BAC3B403C4C2B1049565540A0035B713BAC3B406C7947A94656554080589BE23AAC3B408C391E6645565540307A873939AC3B4008BE168741565540008E8A9B36AC3B40A42B34F93F56554070E5F09236AC3B400C8D224C3B565540E08483F139AC3B400C5A06E03A565540A05E01DE3DAC3B40DC9B6D453A5655408048893442AC3B403CE8DBA738565540A075F77E47AC3B40D42A1D2B3656554010EA6D844DAC3B4000E8932B35565540705390FF4FAC3B40C80D5ABC3356554050E151D851AC3B40E8CE48DF32565540C0DCB68153AC3B4034AC08623056554050CD75BE5BAC3B40BC6ED93B2E56554050AC971263AC3B401CDB296F2A565540C0E02EEB68AC3B40B8376A7C2C56554000D0CB0676AC3B4040FE77A82E565540D0905F1585AC3B4098A2CBA3305655401004A9B491AC3B40D44B98263556554060E8D902B2AC3B40DC5E09703756554090A1F039C1AC3B40A8EAE41A36565540804AF67CC6AC3B40B8D3AA653756554010A8AAD5D1AC3B406C85176B3A565540A0F6F267E9AC3B40F48591EA4056554050EF5C731FAD3B407C49B6EA42565540300C632D32AD3B40F83857AF4556554030524D3049AD3B406859A8CB475655401073F8865AAD3B407CEC4D7649565540707FA2CF59AD3B4034B9B5E04B56554090C93A5B57AD3B40288868A150565540808A97EB51AD3B40B0ECCC905356554060DD53F56DAD3B40C0AB68A154565540D0DE361478AD3B40D0947B1356565540B001239E86AD3B40
22,Civil Aviation 3,3,27,524 3 27 1 001,9,,"Long: 85.3619 Lat: 27.7116, Elev: 1310m",85.3619,27.7116,1310,"76,292.66","30,963.20","8,847",Logistics,"Museum, playing park and visiting purpose","Koteshwor, Naya Baneshwor, Gairigaon, Minbhawan areas",All year round,Civil Aviation Department,Tribhuwan International Airport nearby the site,yes,Yes,Yes (concrete wall),Yes,Yes Sparse vegetation nearby museum,KMC Hospital,Gaushala – Sinamangal,Yes (Gaushala Bit and Near Army at Golf Club and Airport),Yes,"KMC college, Bridgewater International College and Nasa College",-,"Civil Aviation 3 is in the eastern part of Kathmandu Valley. It extends to an area of 76,292.66
sq. m., out of which 30,963.20 sq. m. is found to be usable. The site is under the ownership
of the Civil Aviation Department. The previous study suggested the site to be suitable for
logistical purposes during a disaster. The updated survey found that recently constructed
aviation museum covers a significant area of this open space. In addition, four new
buildings and a gate have reduced the usable area and its total capacity to accommodate
displaced people during a disaster.",Civil Aviation 3,0.011945,6.98E-06,21,0106000020E610000001000000010300000001000000420000001C72257B92565540200B67B71AB23B4090882C95975655405047D4F311B23B40C81E885696565540A057EBB20BB23B4074E6C7729956554070ED51CA04B23B40C88302259E565540C047794EEEB13B4094DE0FCCA0565540F0DB08D4F4B13B402C01A6A4A3565540D0E9B729E9B13B40A83D413AA5565540A06C2CABE2B13B40542851EDA656554090ECDDCFDBB13B403C1F8BADA7565540C0DDDAEBD8B13B4074376627AB565540D07B248ACBB13B4074135EF5AD56554000B61E8FBFB13B40C49E7883AE56554070851030BDB13B407CFE5294AB565540C0CAA14AA9B13B4044630B55AA565540608314CAA0B13B401CB81ED4A7565540800F69AD8FB13B40881E3053A5565540D0BEB9907EB13B4024FB3153A3565540900CC1B470B13B4008CEFA2EA1565540A0CD9EA161B13B407827699AA05655407034A2C95EB13B40A822486EA0565540705C0A945DB13B40489126EB9D5655403042D1F34BB13B403009872B9B56554010A722AB38B13B40B4097FF698565540E0B8F4D829B13B4020B50C709756554000BF1B9B1FB13B40F0439DA995565540007BBB3814B13B400C98C09194565540602BB06A0DB13B40D412220094565540109C5B130BB13B4000A8806E9356554030A312BC08B13B408CC24A5990565540E0BBF05501B13B40CC52A2368C56554010B0125E02B13B4028BB48338956554030CD4D5D05B13B4050FB9BDE86565540C0D4080607B13B405460F075845655401020523508B13B401474FC0B82565540B02CFFF50DB13B4000AB04A27F565540805CA8B613B13B4014D876967D56554000947F161BB13B402CCCFF607B56554040F0814325B13B40BC5E514B7D565540802BA3C330B13B409098AABF7F565540107C588B3FB13B40C0065BC38056554050F0E8A345B13B4020E80D828156554010A701454BB13B40E8F6063283565540C0C1567F58B13B40FCB8A99284565540000E1A9464B13B40089D188C86565540006E18BA71B13B4018586B7D87565540E0CCC96479B13B40500C72108856554000F73A937FB13B40C038D74988565540102387338AB13B40A89262C78756554010B999CF92B13B4030826E5F87565540E03B3EBC97B13B408021E7BB86565540506008EBA1B13B40FC4EE3968656554090612AECAAB13B40607EF5B38656554030BE77B6B0B13B40846B0CC987565540C08BF545CAB13B40A45823DE88565540505973D5E3B13B4020DFBB288A565540900B2645E9B13B4000EEDAA78B56554020FA73E3E8B13B40848704718D565540B0E363FDEDB13B4004BE62638E565540B0CB0E49F3B13B4084F4C0558F5655407090BD94F8B13B40906AB7818D565540A0C2F82703B23B4004CFAFAD8B565540E0F433BB0DB23B4070C528518E565540E0629DBA0FB23B4004C17881905655400039770913B23B40409F149A915655401076A74115B23B401C72257B92565540200B67B71AB23B40
23,Dasarath Stadium,3,27,524 3 27 1 001,11,,"Long: 85.3150 Lat: 27.6950,Elev:1286m",85.315,27.695,1286,"32,249.58","22,876.91","6,536","Humanitarian Coordination Area, Humanitarian Camp, Helipad","Sports Events, Entertainment Purpose","Kupondole, Sanepa and Kalopul",All year round,Kathmandu Metropolitan City,Bagmati river flows close to the site,yes for the staffs and stakeholders only,yes for the staffs and stakeholders only,Yes (Concrete wall),Yes,Yes Sparse vegetation in the periphery,"Norvic Hospital, Teku Hospital, Maternity Home",Ratnapark-Sundhara market,"Yes (Metropolitan Police, Teku and Nepal Army at Bhadrakali)",Yes,"PEA, Everest College",Management of construction materials in the site,"Dasarath Stadium is in the southwest of Kathmandu Valley, along the bank of Bagmati
River. It extends to an area of 32,249.58 sq. m., out of which 22,876.906 sq. m. is found to
be usable. The site is under the ownership of the National Sports Council and the Ministry
of Youth and Sports. The previous study suggested the site to be suitable for multiple
purposes including humanitarian coordination, humanitarian camp and helipad during a
disaster. The updated survey shows ongoing renovation in the site. Hence, construction
materials were accumulated in some parts of the site. Accumulation of construction
materials have slightly reduced the total usable area in the site temporarily.",Dasarath Stadium,0.006613,2.95E-06,22,0106000020E6100000010000000103000000010000002600000024C564373354554020918696ACB13B4064099C5032545540E0ED0FB9ABB13B40AC5306612D545540801C7442A4B13B408834CD212C54554070F1D08AA4B13B409CDB51E7295455406052F99EA4B13B40E8FFA4A62954554040C8F5EDA3B13B40AC5DC77B26545540C043C10CA4B13B40741D96162554554080D8434BA4B13B4064C3307921545540C0BE676EA4B13B40880D52741F5455407028078BA8B13B404CA0D1601D545540A0EDC5A3ADB13B4000DB434C1D545540F0149098AEB13B402C0AF3511C5455408045E9FDB9B13B40243985BC1B54554020955F07C8B13B40683F00301B545540E00B2986D3B13B40F04D28F4185455408012C4ABFFB13B408CE0F37F19545540905C753900B23B40F8CF084C19545540600F7C6905B23B406452DB4C195455405074FF7B06B23B40107B08BD1954554020E908240BB23B40D485D3E81854554070D356A911B23B40A42CE11E1A545540D0D21A6317B23B40EC2EF8D71B54554020BE2E0521B23B40646326FE1B545540604B1FF321B23B40DC7018B01C545540E04C3E6A25B23B40DC2B16CF1D54554020CD5ECA29B23B40148D64A12154554020B5AB0F2FB23B406814E9E821545540F056ED742FB23B401492640F2354554040CA799F30B23B4078F19FB02554554070D072C631B23B409C8F7B49275455402082514A30B23B40B88D92F9285455406022B2092FB23B403CF19B8F2C545540708D864725B23B40B0AC9D362E54554010FD327C2CB23B40108DCB323054554090E3A81815B23B40B07110B133545540105C64ADE6B13B40F0B50E0B3554554000E6813ACBB13B4024C564373354554020918696ACB13B40
24,Datattraya,3,26,524 3 26 3 003,9,,"Long: 85.4353 Lat: 27.6735, Elev: 1333m",85.4353,27.6735,1333,"1,937.70","1,625.74",464,Medical Assistance Area,"Temple, Pilgrimage, Cultural and tourist purpose",Bhaktapur,All year round,Guthi Sansthan,Dattatraya temple of Bhaktapur Durbar Square,yes for all,No,No,Yes,No,"Bhaktapur Hospital, Bhaktapur Cancer Hospital",Chyamasing market,Yes (Bhaktapur Police Bit and Nepal Army at Sainik School),No,"Saraswati Vidhya Griha, Basu School, Sidhhi School, Khwopa Higher Secondary School",Waste management issue in the temple,"Dattatraya Square is in Bhaktapur, an ancient Newari city in the east corner of Kathmandu
Valley. It extends to an area of 1,937.702 sq. m., out of which 1,625.736 sq. m. is found to be
usable. The site is under the ownership of Guthi Sansthan. The previous study suggested
the site to be suitable for medical assistance during a disaster. The updated survey shows
no major changes in the site besides one electricity pole added in the site. The usable area
has not been reduced and can be utilized during a disaster.",Datattraya,0.002244,1.77E-07,23,0106000020E610000001000000010300000001000000220000003422D92CD45B5540E0A88A2964AC3B4070E90059D45B554030E5082466AC3B405C8FB957D45B554070B29D6E6BAC3B40EC1E2427D45B5540B069256B6EAC3B40C453911DD45B55404006976671AC3B403CAD8D92D45B5540D0A5F6AF71AC3B40740EEDCBD45B554030C2666F71AC3B40E4177DD4D55B5540B0AD6E6471AC3B4094EB97D6D55B5540F0C60AE973AC3B406C8CF1D8D65B5540B0616CC474AC3B40DC95C4D4D65B5540902030C66FAC3B40FCDD3EEBD75B55401045A5BA6FAC3B40D8C86B39D95B5540E070CBAC6FAC3B40B8BB8643D95B5540301A941D71AC3B40AC8D9948DA5B5540D0A5C21271AC3B40B046EB70DA5B5540F06B981972AC3B4070ABF0D0DC5B5540D0F2650072AC3B403C063737DD5B554080BF643072AC3B40A8709970E15B5540D0F2940372AC3B40246404A1E15B554090EF250270AC3B4030F0CBD2E15B5540E045E5896DAC3B4090D22178E15B5540802610746DAC3B405CBC2481E15B5540908B85406AAC3B408C2DD2A0E15B55403088552167AC3B4058D85C1BE05B5540900910BC66AC3B4054B0BB19E05B554050B8E7EF64AC3B4038897471DE5B55402075A88F64AC3B40A4A94B74DE5B554040D8A3F162AC3B40C4269520DC5B55408064E22A63AC3B40600B3393DB5B5540105A642561AC3B406831C70ED85B5540C054179162AC3B40E4A94561D65B5540F09D30F462AC3B404C530E5AD45B5540F09CBC1064AC3B403422D92CD45B5540E0A88A2964AC3B40
25,DWSS,3,27,524 3 27 1 001,8,,"Long: 85.3559, Lat: 27.7110, Elev: 1310m",85.3559,27.711,1310,"57,347.23","30,285.37","8,652",Settlement Camp,Waste water treatment plant,"Baneshwor, Battisputali, Chabahil",All year round,Department of Drinking Water Supplies,Bagmati river flows in its vicinity,yes for all,No,Yes,Yes,Yes (few trees and vegetation),"Tilganga Eye Hospital, Samata Hospital",Gaushala market,Yes (Gaushala Police bit and Nepal Army at Golf Club),No,"Arunima HSS, Mahan Siddhartha HSS, Mokshyada School, Kathmandu International School",-,"DWSS is located in the northeast corner of Kathmandu Valley. It extends to an area of
57,347.23 sq. m., out of which 30,285.37 sq. m. is found to be usable. The site is under the
ownership of the Department of Drinking Water Supply. The previous study suggested
the site to be suitable for settlement/camp during a disaster. In the updated survey, the
addition of several wastewater treatment plants, and office buildings were observed. The
added structures along with old structures have almost occupied the entire area of this
site. Hence, previously suggested use for this site will not be applicable.",DWSS,0.008874,4.12E-06,24,0106000020E6100000010000000103000000010000002D000000F0F3EE1FDB5655400028AD573DB63B40D805629ED95655408092B7DD2DB63B402025DABED6565540C0095F0E09B63B404C6B8F64D05655400060602BC5B53B403042BF83CE565540008E2466B7B53B40306684C2CC5655405065C4F1AFB53B40B409EE59CA565540D03C538DACB53B40144AA41CC9565540200D8986ABB53B40AC116E41C6565540D02AD5DAABB53B4074206E24C356554090330356AFB53B40387768E2C0565540A0FA011AB4B53B40389A33DFBE565540500FC9DFC7B53B4010FC777BBB565540007B0906E0B53B4014068EE0B7565540E0CC1EC0EBB53B4038411A55B5565540B00B4EB1F3B53B40C4A8785FB1565540D0A01A5C00B63B4034AAFC0FB05655405002AA8705B63B40C41FA49DAB56554000ED87E520B63B40AC02765BAC565540E05954A921B63B40C4642532AD5655402025CA8E22B63B40FCBAA34FAD56554020E14A5F24B63B40545FE87CAD565540508D880525B63B40BC388DD2AD565540107CC6C425B63B4044A759E8AD565540D0F154B725B63B40B85E9DF0AD56554070BBAF3726B63B403018BF03AE56554040FB5ED928B63B4088DA2F4FAD565540E0A6A6C529B63B40C81994ECAC565540D0C043C02AB63B4038C96A85AB565540F070127B35B63B40A42BF3F2AF5655401077F73934B63B404C8598EBB9565540E0C4F0F72FB63B403001C1FEB9565540C041BC6932B63B40985C9F18BA565540F0CFF0AF34B63B40B40232BFBA565540E0AB9BBE41B63B4024B42434BB56554030A17FD142B63B40C8D1A425BC565540E000A78143B63B407458643FBE565540103DFC2343B63B40EC35CFDEBF565540E044A3DB42B63B4098BB296BC15655407056949642B63B40BCFA0100C556554050F3B3CF41B63B40A88B1A61C65655406068618141B63B40400E32CDCA5655400040487840B63B4078A2C4DBD356554030844F8E3EB63B40C05EF3D9D856554090C2DFB83DB63B40F0F3EE1FDB5655400028AD573DB63B40
26,Election Commission Office,3,27,524 3 27 1 001,27,,"Long: 85.3145, Lat: 27.7121, Elev: 1304.74m",85.3145,27.7121,1304.74,"16,168.61","15,389.14","4,396","Helipad, Distribution Area, Telecommunication","Election Office purpose, Government meetings and functions","Expect IDPs from Thamel, Samakhusi, Lazimpat areas",All year round,Nepal Government,"Famous tourist site, Thamel and Narayanhiti Museum are nearby the site",yes for all,yes for official use only,Yes (concrete wall and fences),Yes,Yes Densely distributed in grassland,"Grande City Hospital, Bir Hospital","Jamal market, Thamel and Durbarmarg market",Yes (APF and Nepal Police within the premises and Nepal Army at Dubarmarg Army camp),No,"Tri – Chandra College, NCCS college, Durbar High School",Lowland ground with drainage issue,"Election Commission Office is located at the center of Kathmandu district with dense
settlement near the identified site. It extends to an area of 16,168.61 sq. m., out of which
15,389.14 sq. m. is found to be usable. The site is under the ownership of the Ministry of
Law, Justice and Constituent Assembly. The previous study suggested the site to be suitable
for multiple purpose including helipad, distribution area and telecommunication during a
disaster. The updated survey shows new constructions in the periphery consisting of four
buildings, two sheds renovated as a single building, and a garage. The recent construction
has reduced the usable area of this site. However, several electrical poles added in the site
can strengthen the camp management during a disaster.",Election Commission Office,0.005135,1.48E-06,25,0106000020E6100000010000000103000000010000001200000024A46EBA265455402098C2AE19B63B40E0F64F8D1354554010D7EBF423B63B40CCBA3EDE13545540C045349C2BB63B4030EBFD1514545540D06B729C35B63B4038DB67A21454554060582C9D44B63B40AC0A87041554554060DDD77448B63B4054374F5516545540C072BEC947B63B40D843A13117545540E0E3273D5DB63B40FC16838618545540505369BF5CB63B401C92F1B01854554020AFB62461B63B4074DEF9611754554010BC36F261B63B40B8A6571818545540D0BD99B373B63B4074E058311854554060B3C0A877B63B403CE9C78E1C545540907CF25975B63B40C0EC9D202A545540E0B19E306EB63B40E838C78F2754554000790A7B2EB63B4040E0EF4E27545540C012E10928B63B4024A46EBA265455402098C2AE19B63B40
